{
  "schema_version": 1,
  "id": "lumont",
  "display_name": "Lumont",
  "source": {
    "title": "Lumont - Benign Horn",
    "name": "Lumont",
    "tags": "Mauler · Tank · Physical",
    "faction": "Mauler",
    "class": "Tank",
    "damage_type": "Physical",
    "description": "A courageous Tank who is skilled at absorbing damage and melee combat.",
    "skills": [
      {
        "section": "Ultimate",
        "name": "Lumont's Charge",
        "unlock": "Unlocks at Level 1",
        "meta": {
          "Skill Range": "8 tiles",
          "Initial Energy": "0"
        },
        "description": {
          "raw": "Lumont selects a tile in range and charges at it, knocking enemies in his path back toward the selected tile. When Lumont reaches the selected tile, he deals 240% (ATK-based) + 30% (SP-based) damage to all adjacent enemies and taunts them for 3s. Lumont is unaffected while casting this skill.",
          "active": [
            "Lumont selects a tile in range and charges at it, knocking enemies in his path back toward the selected tile.",
            "When Lumont reaches the selected tile, he deals 240% (ATK-based) + 30% (SP-based) damage to all adjacent enemies and taunts them for 3s.",
            "Lumont is unaffected while casting this skill."
          ],
          "upgrades": [
            {
              "level": "2",
              "unlock": "Unlocks at Level 51",
              "text": [
                "Increases damage to 260% (ATK-based) + 30% (SP-based)."
              ]
            },
            {
              "level": "3",
              "unlock": "Unlocks at Level 111",
              "text": [
                "Taunts enemies for 4s."
              ]
            },
            {
              "level": "4",
              "unlock": "Unlocks at Level 171",
              "text": [
                "Increases damage to 280% (ATK-based) + 30% (SP-based)."
              ]
            },
            {
              "level": "5",
              "unlock": "Unlocks at Level 231",
              "text": [
                "Increases damage to 300% (ATK-based) + 30% (SP-based)."
              ]
            }
          ]
        },
        "description_lite": "Lumont charges toward enemies in a line, dealing damage and knocking them back toward the selected tile."
      },
      {
        "section": "Skill1",
        "name": "Totem Ward",
        "unlock": "Unlocks at Level 11",
        "meta": {
          "Cooldown": "15s",
          "Initial Cooldown": "4s",
          "Skill Range": "Global"
        },
        "description": {
          "raw": "Lumont gains a shield from Totem ward that blocks 450% (ATK-based) + 40% (SP-based) damage for 12s. For every adjacent enemy, the shield value is increased by 30%. He also increases Phys DEF of 2 closest allies by 30% for 7s.",
          "active": [
            "Lumont gains a shield from Totem ward that blocks 450% (ATK-based) + 40% (SP-based) damage for 12s.",
            "For every adjacent enemy, the shield value is increased by 30%.",
            "He also increases Phys DEF of 2 closest allies by 30% for 7s."
          ],
          "upgrades": [
            {
              "level": "2",
              "unlock": "Unlocks at Level 71",
              "text": [
                "Increases the shield value by 35% for every adjacent enemy."
              ]
            },
            {
              "level": "3",
              "unlock": "Unlocks at Level 131",
              "text": [
                "Increases the shield value by 40% for every adjacent enemy."
              ]
            },
            {
              "level": "4",
              "unlock": "Unlocks at Level 191",
              "text": [
                "Increases the shield value by 45% for every adjacent enemy."
              ]
            }
          ]
        },
        "description_lite": "Lumont gains a shield. THe more enemies nearby, the higher the shield value."
      },
      {
        "section": "Skill2",
        "name": "War Stomp",
        "unlock": "Unlocks at Level 31",
        "meta": {
          "Cooldown": "6s",
          "Initial Cooldown": "1s",
          "Skill Range": "1 tile"
        },
        "description": {
          "raw": "Lumont stomps the ground dealing 240% (ATK-based) damage to adjacent enemies and stunning them for 1 + 0.25 (SP-based)s.",
          "active": [
            "Lumont stomps the ground dealing 240% (ATK-based) damage to adjacent enemies and stunning them for 1 + 0.25 (SP-based)s."
          ],
          "upgrades": [
            {
              "level": "2",
              "unlock": "Unlocks at Level 91",
              "text": [
                "Increases dmaage to 260% (ATK-based)."
              ]
            },
            {
              "level": "3",
              "unlock": "Unlocks at Level 151",
              "text": [
                "Reduces this skill's cooldown by 1s for every enemy hit."
              ]
            },
            {
              "level": "4",
              "unlock": "Unlocks at Level 211",
              "text": [
                "Increases dmaage to 280% (ATK-based)."
              ]
            }
          ]
        },
        "description_lite": "Lumont stomps the ground to deal AoE damage."
      },
      {
        "section": "Unlocks at Legendary+",
        "name": "Hero Focus",
        "unlock": "Unlocks at Legendary+",
        "meta": {
          "Skill Range": "1 tile"
        },
        "description": {
          "raw": "Lumont increases his Haste by 9 during battle. His Haste is increased by an extra 6 when there are at least 2 enemies nearby.",
          "active": [
            "Lumont increases his Haste by 9 during battle.",
            "His Haste is increased by an extra 6 when there are at least 2 enemies nearby."
          ],
          "upgrades": [
            {
              "level": "2",
              "unlock": null,
              "text": [
                "Lumont increases his Haste by 12 during battle.",
                "His Haste is increased by an extra 8 when there are at least 2 enemies nearby."
              ]
            },
            {
              "level": "3",
              "unlock": null,
              "text": [
                "Lumont increases his Haste by 15 during battle.",
                "His Haste is increased by an extra 10 when there are at least 2 enemies nearby."
              ]
            }
          ]
        },
        "description_lite": "Lumont increases his Haste during battle, and it further increases when there are multiple enemies."
      },
      {
        "section": "Ex. Skill",
        "name": "Totem Slam",
        "unlock": "Unlocks at Mythic+",
        "meta": {
          "Initial Cooldown": "0.25s",
          "Skill Range": "1 tile"
        },
        "description": {
          "raw": "Lumont slams the ground with totem 3 times after receiving damage equal to 40% of his max HP, dealing 150% (ATK-based) damage to enemies within 1, 2, and 3 tiles in order and reducing their ATK by 25% for 6s. His 3rd slam also knocks the enemies hit into the air. Lumont is unaffected while casting this skill.",
          "active": [
            "Lumont slams the ground with totem 3 times after receiving damage equal to 40% of his max HP, dealing 150% (ATK-based) damage to enemies within 1, 2, and 3 tiles in order and reducing their ATK by 25% for 6s.",
            "His 3rd slam also knocks the enemies hit into the air.",
            "Lumont is unaffected while casting this skill."
          ],
          "upgrades": [
            {
              "level": "2",
              "unlock": "Unlocks at EX. +5",
              "text": [
                "Gains an extra skill attempt when a battle starts or an ally is defeated for the first time."
              ]
            },
            {
              "level": "3",
              "unlock": "Unlocks at EX. +10",
              "text": [
                "Increases damage to 180% (ATK-based)."
              ]
            },
            {
              "level": "4",
              "unlock": "Unlocks at EX. +15",
              "text": [
                "Increases damage to 210% (ATK-based)."
              ]
            }
          ]
        },
        "description_lite": "Lumont slams the ground after receiving a certain amount of damage, dealing damage to enemies within various ranges and reducing their ATK."
      },
      {
        "section": "Unlocks at Supreme+",
        "name": "Enhance Force",
        "unlock": "Unlocks at Supreme+",
        "meta": {},
        "description": {
          "raw": "Lumont recovers 7% (HP-based) HP per second while shielded by Totem Ward.",
          "active": [
            "Lumont recovers 7% (HP-based) HP per second while shielded by Totem Ward."
          ],
          "upgrades": [
            {
              "level": "2",
              "unlock": null,
              "text": [
                "Level 2 (Unlocks with {{Item|Shadow Essence"
              ]
            }
          ]
        },
        "description_lite": "Lumont recovers HP per second while shielded by Totem Ward."
      }
    ],
    "range": 1,
    "release_date": "2024-03-27",
    "prydwen_tiers": {
      "afk_stages": "C",
      "pvp": "C",
      "dream_realm": "C",
      "dream_realm_endless": "C"
    },
    "role_category": "tank"
  },
  "external": {
    "walk_speed": "normal",
    "stat_ranks": {
      "categories": {
        "basic": "average",
        "offensive": "low",
        "defensive": "high",
        "other": "low"
      },
      "stats": {
        "HP": "high",
        "ATK": "low",
        "Phys DEF": "high",
        "Magic DEF": "average",
        "Haste": "low",
        "ATK SPD": "low"
      },
      "roster_percentiles": {
        "HP": 0.9453,
        "Phys DEF": 0.9844,
        "Magic DEF": 0.9297
      }
    }
  }
}
