{
  "schema_version": 1,
  "id": "hammie",
  "display_name": "Hammie",
  "source": {
    "title": "Hammie - Acorn Mage",
    "name": "Hammie",
    "tags": "Lightbearer · Support · Magic",
    "faction": "Lightbearer",
    "class": "Support",
    "damage_type": "Magic",
    "description": "A Hamster Mage who is passionate about food, and providing healing and bonuses to nearby allies.",
    "skills": [
      {
        "section": "Ultimate",
        "name": "Pretty Fireball",
        "unlock": "Unlocks at Level 1",
        "meta": {
          "Initial Cooldown": "1s",
          "Skill Range": "5 tiles",
          "Initial Energy": "0",
          "Cooldown": "1s"
        },
        "description": {
          "raw": "Hammie charges up to shoot a fireball, dealing 260% (ATK-based) damage to the enemy.",
          "active": [
            "Hammie charges up to shoot a fireball, dealing 260% (ATK-based) damage to the enemy."
          ],
          "upgrades": [
            {
              "level": "2",
              "unlock": "Unlocks at Level 51",
              "text": [
                "Increases the damage to 280% (ATK-based)."
              ]
            },
            {
              "level": "3",
              "unlock": "Unlocks at Level 111",
              "text": [
                "Increases the damage to 300% (ATK-based)."
              ]
            },
            {
              "level": "4",
              "unlock": "Unlocks at Level 171",
              "text": [
                "Increases the damage to 320% (ATK-based)."
              ]
            },
            {
              "level": "5",
              "unlock": "Unlocks at Level 231",
              "text": [
                "Increases the damage to 340% (ATK-based)."
              ]
            }
          ]
        },
        "description_lite": "Hammie shoots a fireball to deal damage to the enemy."
      },
      {
        "section": "Skill1",
        "name": "You'll Be Fine",
        "unlock": "Unlocks at Level 11",
        "meta": {
          "Cooldown": "9s",
          "Initial Cooldown": "2s",
          "Skill Range": "5 tiles"
        },
        "description": {
          "raw": "Hammie heals the weakest ally for 160% (ATK-based) HP and increases their ATK by 10% for 5s.",
          "active": [
            "Hammie heals the weakest ally for 160% (ATK-based) HP and increases their ATK by 10% for 5s."
          ],
          "upgrades": [
            {
              "level": "2",
              "unlock": "Unlocks at Level 71",
              "text": [
                "Increases the healing amount to 170% (ATK-based)."
              ]
            },
            {
              "level": "3",
              "unlock": "Unlocks at Level 131",
              "text": [
                "Increases the healing amount to 180% (ATK-based)."
              ]
            },
            {
              "level": "4",
              "unlock": "Unlocks at Level 191",
              "text": [
                "Increases the healing amount to 190% (ATK-based)."
              ]
            }
          ]
        },
        "description_lite": "Hammie heals the weakest ally and buffs them."
      },
      {
        "section": "Skill2",
        "name": "I'm Hungry",
        "unlock": "Unlocks at Level 31",
        "meta": {
          "Cooldown": "7s",
          "Initial Cooldown": "2s",
          "Skill Range": "5 tiles"
        },
        "description": {
          "raw": "Hammie recovers 220% (ATK-based) HP when her HP ratio falls below 70%.",
          "active": [
            "Hammie recovers 220% (ATK-based) HP when her HP ratio falls below 70%."
          ],
          "upgrades": [
            {
              "level": "2",
              "unlock": "Unlocks at Level 91",
              "text": [
                "The healing amount is increased to 230% (ATK-based)."
              ]
            },
            {
              "level": "3",
              "unlock": "Unlocks at Level 151",
              "text": [
                "The healing amount is increased to 240% (ATK-based)."
              ]
            },
            {
              "level": "4",
              "unlock": "Unlocks at Level 211",
              "text": [
                "The healing amount is increased to 250% (ATK-based)."
              ]
            }
          ]
        },
        "description_lite": "Hammie heals herself."
      }
    ],
    "range": 5,
    "release_date": "2024-03-27",
    "role_category": "support"
  },
  "external": {
    "walk_speed": "normal",
    "stat_ranks": {
      "categories": {
        "basic": "low",
        "offensive": "low",
        "defensive": "low",
        "other": "low"
      },
      "stats": {
        "HP": "low",
        "ATK": "low",
        "Phys DEF": "low",
        "Magic DEF": "low",
        "Haste": "low",
        "ATK SPD": "low"
      },
      "roster_percentiles": {
        "HP": 0.0,
        "Phys DEF": 0.0077,
        "Magic DEF": 0.0615
      }
    }
  }
}
